{
  "$schema": "https://json-schema.org/draft/2020-12/schema",
  "$id": "https://openkotor.com/schemas/binary-format.schema.json",
  "title": "Binary Format Description",
  "type": "object",
  "additionalProperties": false,
  "required": ["name", "endianness", "root", "types"],
  "properties": {
    "name": { "type": "string", "description": "Human-readable format name (e.g., GFF)" },
    "description": { "type": "string" },
    "endianness": { "type": "string", "enum": ["little", "big"] },
    "encoding": {
      "type": "string",
      "description": "Default string encoding (e.g., utf-8, windows-1252)",
      "default": "utf-8"
    },
    "pointerSize": {
      "type": "integer",
      "enum": [4, 8],
      "description": "Bytes per pointer when using integral pointers",
      "default": 4
    },
    "magic": {
      "description": "Optional file magic check at offset 0 (hex or base64).",
      "oneOf": [
        { "type": "string", "pattern": "^(0x)?[0-9a-fA-F_]+$" },
        { "type": "string", "contentEncoding": "base64" }
      ]
    },
    "version": {
      "description": "Optional version discovery. Either a literal or a field read spec.",
      "oneOf": [
        { "type": "string" },
        {
          "type": "object",
          "additionalProperties": false,
          "required": ["offset", "length"],
          "properties": {
            "offset": { "$ref": "#/$defs/offset" },
            "length": { "type": "integer", "minimum": 1 },
            "trimNulls": { "type": "boolean", "default": true },
            "encoding": { "type": "string" }
          }
        }
      ]
    },
    "assertions": {
      "type": "array",
      "description": "Global invariants that must hold (e.g., size checks, header fields).",
      "items": { "$ref": "#/$defs/assertion" }
    },
    "sections": {
      "type": "array",
      "description": "Optional named regions/streams inside the file.",
      "items": {
        "type": "object",
        "additionalProperties": false,
        "required": ["name", "offset", "size"],
        "properties": {
          "name": { "type": "string" },
          "offset": { "$ref": "#/$defs/offset" },
          "size": { "$ref": "#/$defs/sizeExpr" },
          "align": { "$ref": "#/$defs/align" },
          "description": { "type": "string" },
          "typeRef": { "type": "string", "description": "Name of type in 'types' to show when drilling into this section." },
          "typeLinks": {
            "type": "array",
            "description": "Optional list of type names to show as links to the Type reference instead of inlining the typeRef. Use for sections (e.g. node tree) that describe a process and reference many types.",
            "items": { "type": "string" },
            "minItems": 1
          }
        }
      }
    },
    "root": {
      "type": "string",
      "description": "Name of the struct in 'types' that begins parsing."
    },
    "types": {
      "type": "object",
      "description": "Type table containing structs, enums, bitflags, and aliases. May be empty if all types come from includes.",
      "additionalProperties": { "$ref": "#/$defs/typeDef" },
      "minProperties": 0
    },
    "includes": {
      "type": "array",
      "description": "Optional list of fragment filenames (e.g. \"mdl-types.json\") in the same directory. Each fragment may define \"types\" and/or \"constants\". Loaded in order and merged into this definition; later fragments override earlier for duplicate keys.",
      "items": { "type": "string", "minLength": 1 },
      "minItems": 1
    },
    "constants": {
      "type": "object",
      "description": "Named numeric or string constants for expressions.",
      "additionalProperties": { "oneOf": [{ "type": "number" }, { "type": "string" }] }
    },
    "layoutSteps": {
      "type": "object",
      "description": "Optional short numbered or bullet steps that explain a region (e.g. model data). Shown after the layout diagram.",
      "additionalProperties": false,
      "properties": {
        "title": { "type": "string", "description": "Section heading (e.g. \"Model data layout\"). Default \"Layout steps\"." },
        "steps": {
          "type": "array",
          "description": "Ordered list of step descriptions. May reference type names; viewer shows as numbered list.",
          "items": { "type": "string" },
          "minItems": 1
        }
      },
      "required": ["steps"]
    }
  },

  "$defs": {
    "formatFragment": {
      "description": "A fragment file that may be included via the top-level \"includes\" array. Defines only \"types\" and/or \"constants\"; other properties are ignored when merged.",
      "type": "object",
      "additionalProperties": false,
      "properties": {
        "types": {
          "type": "object",
          "additionalProperties": { "$ref": "#/$defs/typeDef" }
        },
        "constants": {
          "type": "object",
          "additionalProperties": { "oneOf": [{ "type": "number" }, { "type": "string" }] }
        }
      },
      "minProperties": 1
    },
    "offset": {
      "description": "File-relative offset or expression (e.g., 'header.offset + 32').",
      "oneOf": [
        { "type": "integer", "minimum": 0 },
        { "$ref": "#/$defs/expr" }
      ]
    },
    "align": {
      "type": "integer",
      "minimum": 1,
      "description": "Align current cursor to N-byte boundary before reading."
    },
    "sizeExpr": {
      "description": "Size in bytes, count, or expression resolving to a non-negative integer.",
      "oneOf": [
        { "type": "integer", "minimum": 0 },
        { "$ref": "#/$defs/expr" }
      ]
    },

    "assertion": {
      "type": "object",
      "additionalProperties": false,
      "required": ["expr"],
      "properties": {
        "expr": { "$ref": "#/$defs/expr" },
        "message": { "type": "string" },
        "severity": { "type": "string", "enum": ["error", "warn"], "default": "error" }
      }
    },

    "expr": {
      "type": "string",
      "description": "Expression language (host-defined). May reference prior field names, constants, and special vars (e.g., $pos, $size, $section(\"name\"))."
    },

    "typeDef": {
      "description": "One of: struct, enum, bitflags, alias",
      "oneOf": [
        { "$ref": "#/$defs/structDef" },
        { "$ref": "#/$defs/enumDef" },
        { "$ref": "#/$defs/bitflagsDef" },
        { "$ref": "#/$defs/aliasDef" }
      ]
    },

    "aliasDef": {
      "type": "object",
      "additionalProperties": false,
      "required": ["aliasOf"],
      "properties": {
        "kind": { "const": "alias" },
        "aliasOf": { "$ref": "#/$defs/typeRef" },
        "description": { "type": "string" }
      }
    },

    "enumDef": {
      "type": "object",
      "additionalProperties": false,
      "required": ["kind", "base", "values"],
      "properties": {
        "kind": { "const": "enum" },
        "description": { "type": "string" },
        "base": { "$ref": "#/$defs/primitive" },
        "values": {
          "type": "object",
          "description": "Map of symbolic name -> integer value",
          "additionalProperties": { "type": "integer" }
        }
      }
    },

    "bitflagsDef": {
      "type": "object",
      "additionalProperties": false,
      "required": ["kind", "base", "bits"],
      "properties": {
        "kind": { "const": "bitflags" },
        "description": { "type": "string" },
        "base": { "$ref": "#/$defs/primitiveInt" },
        "bits": {
          "type": "object",
          "description": "Map name -> bit index or mask integer.",
          "additionalProperties": { "oneOf": [ { "type": "integer", "minimum": 0 }, { "type": "string", "pattern": "^(0x)?[0-9a-fA-F_]+$" } ] }
        }
      }
    },

    "structDef": {
      "type": "object",
      "additionalProperties": false,
      "required": ["kind", "fields"],
      "properties": {
        "kind": { "const": "struct" },
        "description": { "type": "string" },
        "align": { "$ref": "#/$defs/align" },
        "extends": { "type": "string", "description": "Optional base struct name" },
        "fields": {
          "type": "array",
          "items": { "$ref": "#/$defs/field" },
          "minItems": 1
        },
        "assertions": {
          "type": "array",
          "items": { "$ref": "#/$defs/assertion" }
        }
      }
    },

    "field": {
      "type": "object",
      "additionalProperties": false,
      "required": ["name", "type"],
      "properties": {
        "name": { "type": "string" },
        "description": { "type": "string" },
        "doc": { "type": "string" },

        "type": { "$ref": "#/$defs/typeRefOrInline" },

        "offset": {
          "description": "If present, seek before reading this field.",
          "$ref": "#/$defs/offset"
        },
        "relativeTo": {
          "type": "string",
          "description": "Anchor for relative offset (e.g., a previously read pointer field name or 'file', or a section name).",
          "default": "file"
        },
        "align": { "$ref": "#/$defs/align" },

        "count": {
          "description": "For arrays: element count (int or expr). If omitted, scalar.",
          "$ref": "#/$defs/sizeExpr"
        },
        "terminator": {
          "description": "For strings or byte arrays terminated by a value (e.g., 0).",
          "oneOf": [
            { "type": "integer", "minimum": 0, "maximum": 255 },
            { "type": "string", "pattern": "^(0x)?[0-9a-fA-F_]+$" }
          ]
        },
        "length": {
          "description": "For fixed-length strings/bytes: exact length (int or expr).",
          "$ref": "#/$defs/sizeExpr"
        },

        "switch": { "$ref": "#/$defs/switch" },
        "when": { "$ref": "#/$defs/expr", "description": "Condition to include/read this field" },

        "transform": {
          "type": "string",
          "description": "Post-read transform (host-defined, e.g., 'zlib.inflate', 'readCString')"
        },

        "encoding": { "type": "string", "description": "Override encoding for this field" },

        "constraints": {
          "type": "array",
          "items": { "$ref": "#/$defs/assertion" }
        }
      }
    },

    "switch": {
      "type": "object",
      "additionalProperties": false,
      "required": ["selector", "cases"],
      "properties": {
        "selector": { "$ref": "#/$defs/expr" },
        "cases": {
          "type": "object",
          "additionalProperties": { "$ref": "#/$defs/typeRefOrInline" },
          "description": "Map of literal selector value (string/number) to a type to read."
        },
        "default": { "$ref": "#/$defs/typeRefOrInline" }
      }
    },

    "typeRefOrInline": {
      "description": "Reference a named type, or inline a composite/primitive/pointer/bitfield.",
      "oneOf": [
        { "$ref": "#/$defs/typeRef" },
        { "$ref": "#/$defs/pointer" },
        { "$ref": "#/$defs/bitfieldInline" },
        { "$ref": "#/$defs/primitive" },
        { "$ref": "#/$defs/bytesType" },
        { "$ref": "#/$defs/stringType" },
        { "$ref": "#/$defs/structDef" }
      ]
    },

    "typeRef": {
      "type": "string",
      "description": "Name of a type defined in 'types'."
    },

    "primitive": {
      "description": "Primitive scalar types including floats and bool",
      "oneOf": [
        { "$ref": "#/$defs/primitiveInt" },
        { "type": "string", "enum": ["f32", "f64", "bool"] }
      ]
    },
    "primitiveInt": {
      "type": "string",
      "enum": [
        "u8","u16","u32","u64","u128",
        "s8","s16","s32","s64","s128"
      ]
    },

    "bytesType": {
      "type": "object",
      "additionalProperties": false,
      "required": ["kind"],
      "properties": {
        "kind": { "const": "bytes" },
        "length": { "$ref": "#/$defs/sizeExpr" },
        "terminator": { "$ref": "#/$defs/field/properties/terminator" },
        "align": { "$ref": "#/$defs/align" },
        "description": { "type": "string" }
      }
    },

    "stringType": {
      "type": "object",
      "additionalProperties": false,
      "required": ["kind"],
      "properties": {
        "kind": { "const": "string" },
        "encoding": { "type": "string" },
        "length": { "$ref": "#/$defs/sizeExpr", "description": "Fixed byte length (before decoding)" },
        "terminator": { "$ref": "#/$defs/field/properties/terminator" },
        "description": { "type": "string" }
      }
    },

    "pointer": {
      "type": "object",
      "additionalProperties": false,
      "required": ["kind", "to"],
      "properties": {
        "kind": { "const": "pointer" },
        "to": { "$ref": "#/$defs/typeRefOrInline" },
        "addressType": {
          "description": "Integral type used to read the pointer (defaults to global pointerSize).",
          "oneOf": [
            { "$ref": "#/$defs/primitiveInt" },
            { "type": "integer", "enum": [4, 8] }
          ]
        },
        "relativeTo": {
          "type": "string",
          "description": "Anchor base for pointer (e.g., 'file', a section name, or a field path)",
          "default": "file"
        },
        "nullIs": {
          "type": "string",
          "enum": ["empty", "absent"],
          "default": "empty",
          "description": "How to treat a null pointer"
        },
        "count": { "$ref": "#/$defs/sizeExpr", "description": "Optional count for pointer-to-array" },
        "stride": {
          "description": "For raw-pointer arrays when element size can't be inferred.",
          "oneOf": [{ "type": "integer", "minimum": 1 }, { "$ref": "#/$defs/expr" }]
        },
        "follow": {
          "type": "boolean",
          "default": true,
          "description": "If false, leave as numeric address without dereferencing."
        }
      }
    },

    "bitfieldInline": {
      "type": "object",
      "additionalProperties": false,
      "required": ["kind", "base", "fields"],
      "properties": {
        "kind": { "const": "bitfield" },
        "base": { "$ref": "#/$defs/primitiveInt", "description": "Storage width" },
        "lsb0": {
          "type": "boolean",
          "default": true,
          "description": "Bit numbering from LSB (true) or MSB (false)"
        },
        "fields": {
          "type": "array",
          "items": {
            "type": "object",
            "additionalProperties": false,
            "required": ["name", "width"],
            "properties": {
              "name": { "type": "string" },
              "width": { "type": "integer", "minimum": 1 },
              "signed": { "type": "boolean", "default": false },
              "enum": { "type": "string", "description": "Enum name in 'types' to map values" },
              "description": { "type": "string" }
            }
          }
        }
      }
    }
  }
}
